{
  "$schema": "https://json-schema.org/draft/2020-12/schema",
  "$id": "https://academy.dtfseeds.com/schemas/reference.schema.json",
  "title": "THC Academy Reference",
  "type": "object",
  "required": ["id", "type", "title", "status", "evidenceLevel"],
  "properties": {
    "id": {"type": "string", "pattern": "^REF-[A-Z0-9-]+$"},
    "type": {"enum": ["journal", "peer-reviewed-study", "peer-reviewed-review", "peer-reviewed-protocol", "review", "standard", "government", "extension", "university-extension", "textbook", "industry", "other"]},
    "title": {"type": "string", "minLength": 3},
    "publisher": {"type": ["string", "null"]},
    "journal": {"type": ["string", "null"]},
    "authors": {"type": "array", "items": {"type": "string"}},
    "year": {"type": ["integer", "null"]},
    "doi": {"type": ["string", "null"]},
    "pmcid": {"type": ["string", "null"]},
    "pmid": {"type": ["string", "null"]},
    "url": {"type": ["string", "null"]},
    "status": {"enum": ["needs-authoritative-source", "candidate", "reviewed", "reviewed-source", "superseded", "retracted"]},
    "evidenceLevel": {"enum": ["unverified", "peer-reviewed", "university-extension", "standards-government", "standard", "textbook", "industry-technical", "experiential", "A", "B", "C"]},
    "supportsDomains": {"type": "array", "uniqueItems": true, "items": {"type": "string", "minLength": 1}},
    "notes": {"type": ["string", "null"]},
    "retrievedAt": {"type": ["string", "null"], "format": "date-time"},
    "lastVerifiedAt": {"type": ["string", "null"], "format": "date-time"},
    "sourceRevisionDate": {"type": ["string", "null"], "format": "date"},
    "supersedes": {"type": "array", "uniqueItems": true, "items": {"type": "string", "pattern": "^REF-[A-Z0-9-]+$"}},
    "extensions": {
      "type": "object",
      "description": "Open namespaced provenance, jurisdiction, maintenance, archive, evidence-role, or publisher metadata that does not belong in the stable core reference contract.",
      "additionalProperties": true
    }
  },
  "additionalProperties": false
}
