{"id":"REF-UMASS-GREENHOUSE-SANITATION","type":"extension","title":"Cleaning and Disinfecting the Greenhouse","publisher":"University of Massachusetts Amherst Extension","journal":null,"authors":[],"year":2026,"doi":null,"pmcid":null,"pmid":null,"url":"https://www.umass.edu/agriculture-food-environment/greenhouse-floriculture/fact-sheets/cleaning-disinfecting-greenhouse","status":"reviewed-source","evidenceLevel":"university-extension","supportsDomains":["safety-responsible-practice","biosecurity","cultivation-operations"],"notes":"Supports the distinction between physical cleaning and disinfection, removal of organic matter before disinfectant use, greenhouse sanitation, tool/bench/container hygiene, and label-directed disinfectant use."}
