{
  "id": "REF-SAFETY-OSHA-CONTROLS-002",
  "type": "government",
  "title": "Safety Management - Hazard Prevention and Control",
  "publisher": "Occupational Safety and Health Administration",
  "authors": [],
  "year": 2026,
  "doi": null,
  "url": "https://www.osha.gov/safety-management/hazard-prevention",
  "status": "reviewed",
  "evidenceLevel": "standards-government",
  "notes": "Use for hierarchy-of-controls reasoning, hazard control planning, emergency/nonroutine work planning, worker involvement, and verification that controls remain effective."
}
