{"id":"REF-PSU-GREENHOUSE-DISEASE-SOURCES","type":"extension","title":"Sources of Plant Disease in Greenhouses","publisher":"Penn State Extension","journal":null,"authors":[],"year":2023,"doi":null,"pmcid":null,"pmid":null,"url":"https://extension.psu.edu/sources-of-plant-disease-in-greenhouses","status":"reviewed-source","evidenceLevel":"university-extension","supportsDomains":["biosecurity","plant-disease","cultivation-operations"],"notes":"Supports instruction on pathogen movement through contaminated soil, tools, hose ends, plant debris, containers and work surfaces and on keeping clean media/materials from being recontaminated."}
