{
  "id": "REF-CANNABIS-SUBSTRATE-2020-001",
  "type": "peer-reviewed-study",
  "title": "Impact of Different Growing Substrates on Growth, Yield and Cannabinoid Content of Two Cannabis sativa L. Genotypes in a Pot Culture",
  "publisher": "MDPI",
  "journal": "Horticulturae",
  "authors": [
    "Lisa Burgel",
    "Jens Hartung",
    "Simone Graeff-Hönninger"
  ],
  "year": 2020,
  "doi": "10.3390/horticulturae6040062",
  "url": "https://www.mdpi.com/2311-7524/6/4/62",
  "status": "reviewed-source",
  "evidenceLevel": "peer-reviewed",
  "supportsDomains": [
    "root-zone-management",
    "growing-media",
    "cannabis-cultivation"
  ],
  "notes": "Cannabis-specific pot-culture comparison of peat mix, peat with green-fibre substitution and coco coir across two genotypes. Supports substrate-dependent root growth, biomass/yield and genotype interaction. It does not establish one universally superior medium or transferable irrigation schedule.",
  "retrievedAt": "2026-09-24T04:25:00-05:00",
  "lastVerifiedAt": "2026-09-24T04:25:00-05:00",
  "sourceRevisionDate": "2022-03-31"
}
