{"id":"REF-WATER-ALKALINITY-EXT-001","type":"extension","title":"Water Quality: pH and Alkalinity","publisher":"University of Massachusetts Amherst Extension","authors":["UMass Amherst Greenhouse and Floriculture Program"],"year":2026,"url":"https://www.umass.edu/agriculture-food-environment/pt/greenhouse-floriculture/fact-sheets/water-quality-ph-alkalinity","status":"reviewed","evidenceLevel":"university-extension","notes":"General controlled-environment horticulture reference distinguishing irrigation-water pH from alkalinity/bicarbonate buffering. Use as foundational water chemistry, not cannabis-specific target authority."}
