{
  "id": "REF-CANNABIS-PHOTOPERIOD-2023-001",
  "type": "peer-reviewed-study",
  "title": "Is Twelve Hours Really the Optimum Photoperiod for Promoting Flowering in Indoor-Grown Cultivars of Cannabis sativa?",
  "year": 2023,
  "journal": "Plants",
  "pmcid": "PMC10386198",
  "pmid": "37514220",
  "url": "https://pmc.ncbi.nlm.nih.gov/articles/PMC10386198/",
  "status": "reviewed-source",
  "evidenceLevel": "A",
  "supportsDomains": [
    "flowering-maturity-harvest",
    "lighting-photosynthesis"
  ],
  "notes": "Supports cultivar-dependent flowering responses under multiple photoperiods and reinforces that 12 h light/12 h dark is a common production convention rather than a universal biological optimum for every cannabis genotype."
}
