{"id":"REF-WHO-DATA-INTEGRITY-2021","type":"government","title":"TRS 1033 - Annex 4: WHO Guideline on data integrity","publisher":"World Health Organization","journal":null,"authors":[],"year":2021,"doi":null,"pmcid":null,"pmid":null,"url":"https://www.who.int/publications/m/item/annex-4-trs-1033","status":"reviewed-source","evidenceLevel":"standards-government","supportsDomains":["records-traceability","quality-systems","cultivation-operations"],"notes":"Supports ALCOA+ concepts, record lifecycle integrity, controlled corrections, traceable changes, and good documentation practices as a transferable quality-system model. It is pharmaceutical-quality guidance, not cannabis law."}
