{
  "id": "REF-GREENHOUSE-WATER-QUALITY-PSU-2025",
  "type": "extension",
  "title": "A Water Quality Toolkit for Greenhouse and Nursery Production",
  "year": 2025,
  "publisher": "Penn State Extension",
  "url": "https://extension.psu.edu/a-water-quality-toolkit-for-greenhouse-and-nursery-production",
  "status": "reviewed-source",
  "evidenceLevel": "B",
  "supportsDomains": [
    "water-irrigation",
    "root-zone-media",
    "plant-nutrition"
  ],
  "notes": "Supports distinctions among pH, alkalinity, hardness and electrical conductivity in greenhouse water management. Use for general horticultural water chemistry; crop-specific numeric targets are not universal cannabis recommendations."
}
